{
  "titleMode": "shown",
  "background": {
    "color": "#071d1b",
    "particles": false,
    "seed": 8
  },
  "subtitleSize": 46,
  "protectedTerms": [],
  "scenes": [
    {
      "id": "shot-01",
      "startUs": 0,
      "endUs": 6680000,
      "nodes": [
        {
          "id": "title-panel",
          "type": "rect",
          "x": 110,
          "y": 194,
          "width": 860,
          "height": 122,
          "background": "#0b2927",
          "color": "#265c50",
          "radius": 20
        },
        {
          "id": "title-1",
          "type": "text",
          "x": 130,
          "y": 235,
          "width": 820,
          "height": 72,
          "text": "丛枝菌根作用与优势",
          "size": 48,
          "color": "#65efb5",
          "align": "center"
        },
        {
          "id": "heading",
          "type": "text",
          "x": 130,
          "y": 440,
          "width": 820,
          "height": 92,
          "text": "回顾：菌剂与菌根",
          "size": 58,
          "color": "#eef9f3",
          "align": "left"
        },
        {
          "id": "section-rule",
          "type": "rect",
          "x": 132,
          "y": 553,
          "width": 88,
          "height": 5,
          "background": "#65efb5",
          "color": "#65efb5",
          "radius": 2
        },
        {
          "id": "card-1",
          "type": "rect",
          "x": 130,
          "y": 620,
          "width": 820,
          "height": 170,
          "background": "#10332f",
          "color": "#28554b",
          "radius": 24,
          "enterUs": 480000,
          "entrance": "fade-up"
        },
        {
          "id": "item-1",
          "type": "text",
          "x": 172,
          "y": 650,
          "width": 736,
          "height": 110,
          "text": "真菌类菌剂的分类",
          "size": 52,
          "color": "#eef9f3",
          "align": "left",
          "enterUs": 480000,
          "entrance": "fade-up",
          "enterDelayUs": 90000
        },
        {
          "id": "card-2",
          "type": "rect",
          "x": 130,
          "y": 825,
          "width": 820,
          "height": 170,
          "background": "#10332f",
          "color": "#28554b",
          "radius": 24,
          "enterUs": 2880000,
          "entrance": "slide-left"
        },
        {
          "id": "item-2",
          "type": "text",
          "x": 172,
          "y": 855,
          "width": 736,
          "height": 110,
          "text": "肥料类菌剂中的菌根",
          "size": 52,
          "color": "#eef9f3",
          "align": "left",
          "enterUs": 2880000,
          "entrance": "slide-left",
          "enterDelayUs": 90000
        },
        {
          "id": "card-3",
          "type": "rect",
          "x": 130,
          "y": 1030,
          "width": 820,
          "height": 170,
          "background": "#10332f",
          "color": "#28554b",
          "radius": 24,
          "enterUs": 5920000,
          "entrance": "slide-right"
        },
        {
          "id": "item-3",
          "type": "text",
          "x": 172,
          "y": 1060,
          "width": 736,
          "height": 110,
          "text": "连接上期基本特性",
          "size": 52,
          "color": "#eef9f3",
          "align": "left",
          "enterUs": 5920000,
          "entrance": "slide-right",
          "enterDelayUs": 90000,
          "emphasis": {
            "kind": "color",
            "timeUs": 5920000
          }
        }
      ],
      "transition": "push"
    },
    {
      "id": "shot-02",
      "startUs": 6680000,
      "endUs": 15040000,
      "nodes": [
        {
          "id": "title-panel",
          "type": "rect",
          "x": 110,
          "y": 194,
          "width": 860,
          "height": 122,
          "background": "#0b2927",
          "color": "#265c50",
          "radius": 20
        },
        {
          "id": "title-1",
          "type": "text",
          "x": 130,
          "y": 235,
          "width": 820,
          "height": 72,
          "text": "丛枝菌根作用与优势",
          "size": 48,
          "color": "#65efb5",
          "align": "center"
        },
        {
          "id": "heading",
          "type": "text",
          "x": 130,
          "y": 440,
          "width": 820,
          "height": 92,
          "text": "这期看机制与应用",
          "size": 58,
          "color": "#eef9f3",
          "align": "left"
        },
        {
          "id": "section-rule",
          "type": "rect",
          "x": 132,
          "y": 553,
          "width": 88,
          "height": 5,
          "background": "#65efb5",
          "color": "#65efb5",
          "radius": 2
        },
        {
          "id": "item-1",
          "type": "text",
          "x": 150,
          "y": 680,
          "width": 780,
          "height": 220,
          "text": "从吸收机制开始",
          "size": 82,
          "color": "#eef9f3",
          "align": "center",
          "enterUs": 600000,
          "entrance": "fade-up",
          "enterDelayUs": 0
        },
        {
          "id": "item-2",
          "type": "text",
          "x": 150,
          "y": 965,
          "width": 780,
          "height": 220,
          "text": "再看实际应用优势",
          "size": 48,
          "color": "#eef9f3",
          "align": "center",
          "enterUs": 6000000,
          "entrance": "slide-left",
          "enterDelayUs": 0,
          "emphasis": {
            "kind": "marker",
            "timeUs": 6000000
          }
        }
      ],
      "transition": "fade"
    },
    {
      "id": "shot-03",
      "startUs": 15040000,
      "endUs": 21960000,
      "nodes": [
        {
          "id": "title-panel",
          "type": "rect",
          "x": 110,
          "y": 194,
          "width": 860,
          "height": 122,
          "background": "#0b2927",
          "color": "#265c50",
          "radius": 20
        },
        {
          "id": "title-1",
          "type": "text",
          "x": 130,
          "y": 235,
          "width": 820,
          "height": 72,
          "text": "丛枝菌根作用与优势",
          "size": 48,
          "color": "#65efb5",
          "align": "center"
        },
        {
          "id": "heading",
          "type": "text",
          "x": 130,
          "y": 440,
          "width": 820,
          "height": 92,
          "text": "磷为何难被吸收",
          "size": 58,
          "color": "#eef9f3",
          "align": "left"
        },
        {
          "id": "section-rule",
          "type": "rect",
          "x": 132,
          "y": 553,
          "width": 88,
          "height": 5,
          "background": "#65efb5",
          "color": "#65efb5",
          "radius": 2
        },
        {
          "id": "card-1",
          "type": "rect",
          "x": 130,
          "y": 620,
          "width": 820,
          "height": 170,
          "background": "#10332f",
          "color": "#28554b",
          "radius": 24,
          "enterUs": 400000,
          "entrance": "fade-up"
        },
        {
          "id": "bullet-1",
          "type": "rect",
          "x": 145,
          "y": 660,
          "width": 8,
          "height": 40,
          "background": "#ebc86d",
          "color": "#ebc86d",
          "radius": 3,
          "enterUs": 400000,
          "entrance": "fade-up"
        },
        {
          "id": "item-1",
          "type": "text",
          "x": 172,
          "y": 650,
          "width": 736,
          "height": 110,
          "text": "磷素吸收是重点",
          "size": 52,
          "color": "#eef9f3",
          "align": "left",
          "enterUs": 400000,
          "entrance": "fade-up",
          "enterDelayUs": 90000
        },
        {
          "id": "card-2",
          "type": "rect",
          "x": 130,
          "y": 794,
          "width": 820,
          "height": 170,
          "background": "#10332f",
          "color": "#28554b",
          "radius": 24,
          "enterUs": 3520000,
          "entrance": "slide-left"
        },
        {
          "id": "bullet-2",
          "type": "rect",
          "x": 145,
          "y": 834,
          "width": 8,
          "height": 40,
          "background": "#ebc86d",
          "color": "#ebc86d",
          "radius": 3,
          "enterUs": 3520000,
          "entrance": "slide-left"
        },
        {
          "id": "item-2",
          "type": "text",
          "x": 172,
          "y": 824,
          "width": 736,
          "height": 110,
          "text": "磷被土壤颗粒固定",
          "size": 52,
          "color": "#eef9f3",
          "align": "left",
          "enterUs": 3520000,
          "entrance": "slide-left",
          "enterDelayUs": 90000
        },
        {
          "id": "card-3",
          "type": "rect",
          "x": 130,
          "y": 968,
          "width": 820,
          "height": 170,
          "background": "#10332f",
          "color": "#28554b",
          "radius": 24,
          "enterUs": 4920000,
          "entrance": "slide-right"
        },
        {
          "id": "bullet-3",
          "type": "rect",
          "x": 145,
          "y": 1008,
          "width": 8,
          "height": 40,
          "background": "#ebc86d",
          "color": "#ebc86d",
          "radius": 3,
          "enterUs": 4920000,
          "entrance": "slide-right"
        },
        {
          "id": "item-3",
          "type": "text",
          "x": 172,
          "y": 998,
          "width": 736,
          "height": 110,
          "text": "移动性差",
          "size": 52,
          "color": "#eef9f3",
          "align": "left",
          "enterUs": 4920000,
          "entrance": "slide-right",
          "enterDelayUs": 90000
        },
        {
          "id": "card-4",
          "type": "rect",
          "x": 130,
          "y": 1142,
          "width": 820,
          "height": 170,
          "background": "#10332f",
          "color": "#28554b",
          "radius": 24,
          "enterUs": 5640000,
          "entrance": "zoom"
        },
        {
          "id": "bullet-4",